{
  "format": "neograph-example-disposition-v1",
  "schema_version": 1,
  "status": "p8-audit",
  "authority": "One entry covers each top-level CMake example target source and each cookbook directory. Supporting assets and variants are covered by their parent directory entry; no entry is silently omitted.",
  "disposition_enum": [
    "Core-kept",
    "Program-ported",
    "protocol-adapter-ported",
    "historical-only",
    "removed"
  ],
  "proof_policy": "Every entry records required options, a concrete build target, a run command, and an expected result. `verified` is reserved for focused smoke evidence; `pending-component-smoke` is an explicit remaining P8 item.",
  "documentation": [
    "examples/README.md",
    "examples/cookbook/README.md",
    "docs/V1_ARCHITECTURE.md",
    "docs/V1_MIGRATION_PLAN.md"
  ],
  "entries": [
    {
      "id": "example_core_quickstart",
      "kind": "example",
      "path": "examples/62_core_quickstart.cpp",
      "target": "example_core_quickstart",
      "disposition": "Core-kept",
      "requires": [],
      "rationale": "Current source uses the supported Core graph surface; retain until an explicit Program or adapter port is proven.",
      "proof": {
        "status": "verified",
        "build": "cmake --build <build-dir> --target example_core_quickstart",
        "run": "<build-dir>/example_core_quickstart",
        "expected": "stdout: HELLO"
      }
    },
    {
      "id": "example_program_quickstart",
      "kind": "example",
      "path": "examples/63_program_quickstart.cpp",
      "target": "example_program_quickstart",
      "disposition": "Program-ported",
      "requires": [
        "NEOGRAPH_BUILD_PROGRAM=ON"
      ],
      "rationale": "Program lifecycle or Program-backed Harness surface; retain as the canonical Program-facing example.",
      "proof": {
        "status": "verified",
        "build": "cmake --build <build-dir> --target example_program_quickstart",
        "run": "<build-dir>/example_program_quickstart",
        "expected": "stdout: 1"
      }
    },
    {
      "id": "example_01",
      "kind": "example",
      "path": "examples/01_react_agent.cpp",
      "target": "example_react_agent",
      "disposition": "Core-kept",
      "requires": [
        "NEOGRAPH_BUILD_LLM=ON"
      ],
      "rationale": "Current source uses the supported Core graph surface; retain until an explicit Program or adapter port is proven.",
      "proof": {
        "status": "pending-component-smoke",
        "build": "cmake --build <build-dir> --target example_react_agent",
        "run": "<build-dir>/example_react_agent",
        "expected": "recipe-specific output; exit 0"
      }
    },
    {
      "id": "example_02",
      "kind": "example",
      "path": "examples/02_custom_graph.cpp",
      "target": "example_custom_graph",
      "disposition": "Core-kept",
      "requires": [
        "NEOGRAPH_BUILD_LLM=ON"
      ],
      "rationale": "Current source uses the supported Core graph surface; retain until an explicit Program or adapter port is proven.",
      "proof": {
        "status": "pending-component-smoke",
        "build": "cmake --build <build-dir> --target example_custom_graph",
        "run": "<build-dir>/example_custom_graph",
        "expected": "recipe-specific output; exit 0"
      }
    },
    {
      "id": "example_03",
      "kind": "example",
      "path": "examples/03_mcp_agent.cpp",
      "target": "example_mcp_agent",
      "disposition": "protocol-adapter-ported",
      "requires": [
        "NEOGRAPH_BUILD_LLM=ON",
        "NEOGRAPH_BUILD_MCP_CLIENT=ON"
      ],
      "rationale": "Transport-owned adapter example; retain wire behavior while semantic ownership converges on Core/Program.",
      "proof": {
        "status": "pending-component-smoke",
        "build": "cmake --build <build-dir> --target example_mcp_agent",
        "run": "<build-dir>/example_mcp_agent",
        "expected": "recipe-specific output; exit 0"
      }
    },
    {
      "id": "example_04",
      "kind": "example",
      "path": "examples/04_checkpoint_hitl.cpp",
      "target": "example_checkpoint_hitl",
      "disposition": "Core-kept",
      "requires": [
        "NEOGRAPH_BUILD_LLM=ON"
      ],
      "rationale": "Current source uses the supported Core graph surface; retain until an explicit Program or adapter port is proven.",
      "proof": {
        "status": "pending-component-smoke",
        "build": "cmake --build <build-dir> --target example_checkpoint_hitl",
        "run": "<build-dir>/example_checkpoint_hitl",
        "expected": "recipe-specific output; exit 0"
      }
    },
    {
      "id": "example_05",
      "kind": "example",
      "path": "examples/05_parallel_fanout.cpp",
      "target": "example_parallel_fanout",
      "disposition": "Core-kept",
      "requires": [
        "NEOGRAPH_BUILD_LLM=ON"
      ],
      "rationale": "Current source uses the supported Core graph surface; retain until an explicit Program or adapter port is proven.",
      "proof": {
        "status": "pending-component-smoke",
        "build": "cmake --build <build-dir> --target example_parallel_fanout",
        "run": "<build-dir>/example_parallel_fanout",
        "expected": "recipe-specific output; exit 0"
      }
    },
    {
      "id": "example_06",
      "kind": "example",
      "path": "examples/06_subgraph.cpp",
      "target": "example_subgraph",
      "disposition": "Core-kept",
      "requires": [
        "NEOGRAPH_BUILD_LLM=ON"
      ],
      "rationale": "Current source uses the supported Core graph surface; retain until an explicit Program or adapter port is proven.",
      "proof": {
        "status": "pending-component-smoke",
        "build": "cmake --build <build-dir> --target example_subgraph",
        "run": "<build-dir>/example_subgraph",
        "expected": "recipe-specific output; exit 0"
      }
    },
    {
      "id": "example_07",
      "kind": "example",
      "path": "examples/07_intent_routing.cpp",
      "target": "example_intent_routing",
      "disposition": "Core-kept",
      "requires": [
        "NEOGRAPH_BUILD_LLM=ON"
      ],
      "rationale": "Current source uses the supported Core graph surface; retain until an explicit Program or adapter port is proven.",
      "proof": {
        "status": "pending-component-smoke",
        "build": "cmake --build <build-dir> --target example_intent_routing",
        "run": "<build-dir>/example_intent_routing",
        "expected": "recipe-specific output; exit 0"
      }
    },
    {
      "id": "example_08",
      "kind": "example",
      "path": "examples/08_state_management.cpp",
      "target": "example_state_management",
      "disposition": "Core-kept",
      "requires": [
        "NEOGRAPH_BUILD_LLM=ON"
      ],
      "rationale": "Current source uses the supported Core graph surface; retain until an explicit Program or adapter port is proven.",
      "proof": {
        "status": "pending-component-smoke",
        "build": "cmake --build <build-dir> --target example_state_management",
        "run": "<build-dir>/example_state_management",
        "expected": "recipe-specific output; exit 0"
      }
    },
    {
      "id": "example_09",
      "kind": "example",
      "path": "examples/09_all_features.cpp",
      "target": "example_all_features",
      "disposition": "Core-kept",
      "requires": [
        "NEOGRAPH_BUILD_LLM=ON"
      ],
      "rationale": "Current source uses the supported Core graph surface; retain until an explicit Program or adapter port is proven.",
      "proof": {
        "status": "pending-component-smoke",
        "build": "cmake --build <build-dir> --target example_all_features",
        "run": "<build-dir>/example_all_features",
        "expected": "recipe-specific output; exit 0"
      }
    },
    {
      "id": "example_10",
      "kind": "example",
      "path": "examples/10_send_command.cpp",
      "target": "example_send_command",
      "disposition": "Core-kept",
      "requires": [
        "NEOGRAPH_BUILD_LLM=ON"
      ],
      "rationale": "Current source uses the supported Core graph surface; retain until an explicit Program or adapter port is proven.",
      "proof": {
        "status": "pending-component-smoke",
        "build": "cmake --build <build-dir> --target example_send_command",
        "run": "<build-dir>/example_send_command",
        "expected": "recipe-specific output; exit 0"
      }
    },
    {
      "id": "example_11",
      "kind": "example",
      "path": "examples/11_clay_chatbot.cpp",
      "target": "example_clay_chatbot",
      "disposition": "Core-kept",
      "requires": [
        "NEOGRAPH_BUILD_LLM=ON",
        "NEOGRAPH_BUILD_CLAY_EXAMPLE=ON"
      ],
      "rationale": "Current source uses the supported Core graph surface; retain until an explicit Program or adapter port is proven.",
      "proof": {
        "status": "pending-component-smoke",
        "build": "cmake --build <build-dir> --target example_clay_chatbot",
        "run": "<build-dir>/example_clay_chatbot",
        "expected": "recipe-specific output; exit 0"
      }
    },
    {
      "id": "example_12",
      "kind": "example",
      "path": "examples/12_rag_agent.cpp",
      "target": "example_rag_agent",
      "disposition": "Core-kept",
      "requires": [
        "NEOGRAPH_BUILD_LLM=ON"
      ],
      "rationale": "Current source uses the supported Core graph surface; retain until an explicit Program or adapter port is proven.",
      "proof": {
        "status": "pending-component-smoke",
        "build": "cmake --build <build-dir> --target example_rag_agent",
        "run": "<build-dir>/example_rag_agent",
        "expected": "recipe-specific output; exit 0"
      }
    },
    {
      "id": "example_13",
      "kind": "example",
      "path": "examples/13_openai_responses.cpp",
      "target": "example_openai_responses",
      "disposition": "Core-kept",
      "requires": [
        "NEOGRAPH_BUILD_LLM=ON"
      ],